{
  "artifact_type": "TRAINING_QUIZ",
  "case_id": "n31_media_change",
  "coverage": {
    "all_answers_grounded": true,
    "all_explanations_grounded": true,
    "categories": [
      "ORDERING",
      "TOOL_SELECTION",
      "RISK_RESPONSE",
      "STATUS_RECOGNITION",
      "ERROR_JUDGMENT"
    ],
    "category_count": 5,
    "question_count": 5
  },
  "questions": [
    {
      "answer": [
        "S01",
        "S02",
        "S03",
        "S04"
      ],
      "answer_evidence_ids": [
        "E096",
        "E001",
        "E144",
        "E066",
        "E149",
        "E153",
        "E009",
        "E099",
        "E145",
        "E151",
        "E152",
        "E014",
        "E142"
      ],
      "category": "ORDERING",
      "evidence_details": [
        {
          "claim": "N31 用户手册 2 产品规格 项目 直接热敏 203 / (8 / ) 4打印宽度毫米默认 ，最高 25 - 毫米 32 位RISC RA >=2MB >= MB 传感器 ,缺纸侦测 缝标侦测 ,黑标侦测 ,开盖侦测 折叠纸宽度毫米 ,模切或连80 厚度英寸 0 ) 0.00 英寸 22 微米 纸卷直径 卷芯内径英寸 毫米 英寸 毫米 外挂纸卷5 (127 ) TSPL 标签设计驱动,indows000,Win7,8,10 中文英文：GBK：ASCII ts,12×24dots 7",
          "classification": "SOURCE_FACT",
          "confidence": 0.9,
          "evidence_id": "E096",
          "locator": {
            "page": 12,
            "paragraph": "页面全文候选"
          },
          "relevance": 0.75,
          "review_status": "UNREVIEWED",
          "source_ref": "N31_MANUAL_REV1_0",
          "source_type": "pdf"
        },
        {
          "claim": "CONTINUOUS_OPERATION 关键帧候选；等待授权后的视觉理解或人工确认动作、部件和设备状态。",
          "classification": "MODEL_INFERENCE",
          "confidence": 0.5,
          "evidence_id": "E001",
          "locator": {
            "end_ms": 5000,
            "keyframe": "derived/video/N31_VIDEO_OPERATION_FULL/frames/frame_000001.jpg",
            "start_ms": 0
          },
          "relevance": 0.65,
          "review_status": "UNREVIEWED",
          "source_ref": "N31_VIDEO_OPERATION_FULL",
          "source_type": "video"
        },
        {
          "claim": "本批介质为72×130毫米折叠式热敏标签纸，相邻标签有缝隙，背面没有周期性黑标，应使用缝标定位。",
          "classification": "EXPERT_ADVICE",
          "confidence": 0.95,
          "evidence_id": "E144",
          "locator": {
            "end_ms": 68720,
            "start_ms": 40720
          },
          "relevance": 0.95,
          "review_status": "VERIFIED",
          "source_ref": "N31_EXPERT_INTERVIEW",
          "source_type": "audio"
        },
        {
          "claim": "MEDIA_REVERSE_AND_GAP 关键帧候选；等待授权后的视觉理解或人工确认动作、部件和设备状态。",
          "classification": "MODEL_INFERENCE",
          "confidence": 0.5,
          "evidence_id": "E066",
          "locator": {
            "end_ms": 5000,
            "keyframe": "derived/video/N31_VIDEO_MEDIA_TYPE/frames/frame_000001.jpg",
            "start_ms": 0
          },
          "relevance": 0.75,
          "review_status": "UNREVIEWED",
          "source_ref": "N31_VIDEO_MEDIA_TYPE",
          "source_type": "video"
        },
        {
          "claim": "本批纸使用缝标学习；按住走纸键，在状态灯第二次闪烁后立即释放，不等待黑标学习对应的后续灯态。",
          "classification": "EXPERT_ADVICE",
          "confidence": 0.95,
          "evidence_id": "E149",
          "locator": {
            "end_ms": 227680,
            "start_ms": 195680
          },
          "relevance": 0.95,
          "review_status": "VERIFIED",
          "source_ref": "N31_EXPERT_INTERVIEW",
          "source_type": "audio"
        },
        {
          "claim": "新手常漏掉介质定位方式判断、内外导纸夹调整，以及装纸后的学习、单张走纸和测试打印。",
          "classification": "EXPERT_ADVICE",
          "confidence": 0.95,
          "evidence_id": "E153",
          "locator": {
            "end_ms": 357600,
            "start_ms": 331760
          },
          "relevance": 0.95,
          "review_status": "VERIFIED",
          "source_ref": "N31_EXPERT_INTERVIEW",
          "source_type": "audio"
        },
        {
          "claim": "CONTINUOUS_OPERATION 关键帧候选；等待授权后的视觉理解或人工确认动作、部件和设备状态。",
          "classification": "MODEL_INFERENCE",
          "confidence": 0.5,
          "evidence_id": "E009",
          "locator": {
            "end_ms": 45000,
            "keyframe": "derived/video/N31_VIDEO_OPERATION_FULL/frames/frame_000009.jpg",
            "start_ms": 40000
          },
          "relevance": 0.65,
          "review_status": "UNREVIEWED",
          "source_ref": "N31_VIDEO_OPERATION_FULL",
          "source_type": "video"
        },
        {
          "claim": "N31 用户手册 .面向机器正面，双手同时向前拨动顶盖开启钮。 向上掀起顶盖。 将卡住的纸张从进纸通道抽出后，请 褶皱的纸丢弃。 10",
          "classification": "SOURCE_FACT",
          "confidence": 0.9,
          "evidence_id": "E099",
          "locator": {
            "page": 15,
            "paragraph": "页面全文候选"
          },
          "relevance": 0.75,
          "review_status": "UNREVIEWED",
          "source_ref": "N31_MANUAL_REV1_0",
          "source_type": "pdf"
        },
        {
          "claim": "换纸前应确认任务完成或暂停、设备无异常、旧纸正常退出、纸路无残纸卡纸异物且新纸平整；卡纸转异常流程，不强拉。",
          "classification": "EXPERT_ADVICE",
          "confidence": 0.95,
          "evidence_id": "E145",
          "locator": {
            "end_ms": 99600,
            "start_ms": 68720
          },
          "relevance": 0.95,
          "review_status": "VERIFIED",
          "source_ref": "N31_EXPERT_INTERVIEW",
          "source_type": "audio"
        },
        {
          "claim": "异常时先停打，再依次检查装反、歪斜、褶皱和送纸位置，检查内外导轨，核对缝标/黑标及学习模式，重做学习和单张走纸，再查尺寸缩放与驱动。",
          "classification": "EXPERT_ADVICE",
          "confidence": 0.95,
          "evidence_id": "E151",
          "locator": {
            "end_ms": 300400,
            "start_ms": 260400
          },
          "relevance": 0.95,
          "review_status": "VERIFIED",
          "source_ref": "N31_EXPERT_INTERVIEW",
          "source_type": "audio"
        },
        {
          "claim": "不得在进纸或打印时强推强拉扭纸，不送入褶皱破损纸，不把缝标纸按黑标学习，不让导纸夹挤压纸边，不暴力处理卡纸或用硬物刮擦胶辊、传感器和热敏区。",
          "classification": "EXPERT_ADVICE",
          "confidence": 0.95,
          "evidence_id": "E152",
          "locator": {
            "end_ms": 331760,
            "start_ms": 300400
          },
          "relevance": 0.95,
          "review_status": "VERIFIED",
          "source_ref": "N31_EXPERT_INTERVIEW",
          "source_type": "audio"
        },
        {
          "claim": "CONTINUOUS_OPERATION 关键帧候选；等待授权后的视觉理解或人工确认动作、部件和设备状态。",
          "classification": "MODEL_INFERENCE",
          "confidence": 0.5,
          "evidence_id": "E014",
          "locator": {
            "end_ms": 70000,
            "keyframe": "derived/video/N31_VIDEO_OPERATION_FULL/frames/frame_000014.jpg",
            "start_ms": 65000
          },
          "relevance": 0.65,
          "review_status": "UNREVIEWED",
          "source_ref": "N31_VIDEO_OPERATION_FULL",
          "source_type": "video"
        },
        {
          "claim": "安装介质 处理卡纸 1.面对机器背面，双手同时按住进纸导轨，依据纸张大小，左右调节导轨间距。 3.将卡住的纸张从进纸通道抽出后，将褶皱 4.将卡住的纸抽出后即可进行正常的介 的纸丢弃。 质安装。 2.将标签纸插入进纸导轨， 纸张则会自动吸入。 保修条款 一、本产品热写头片保证寿命为30KM或3个月（以先到为准），如打印头 出现创伤、刮伤、烧毁、腐蚀等不可抗力因素不在保修范围内，其余 部件保修时间为自购买之日起12个月。 充电/开机使用 二、存在以下情况之一者，不属于保修范围之内： 1.确认打印机电源开关处于关闭（O）状态。 1、未经我公司及授权维修人员许可，擅自对产品进行拆卸，或产品序 2.将电源线连接到打印机。 列号标贴被撕去及模糊不清，无法辨认； 3.将电源线另一端连接到附近的插座。 2、由于固体颗粒刮伤热敏头片，引起的打印白线，则头片不属于保修 范围； ！ 注意：请确保标签纸送到位，标签纸将自动从出纸口送出一小段。 3、其他人为引起的故障。 三、保修期内，维修时所更换的产品零配件归我公司所有； 处理卡纸2.手动向上掀起顶盖。 1.面向机器正面，双手同时向前拨动顶 四、用户负责将产",
          "classification": "SOURCE_FACT",
          "confidence": 0.9,
          "evidence_id": "E142",
          "locator": {
            "page": 2,
            "paragraph": "页面全文候选"
          },
          "relevance": 0.7,
          "review_status": "UNREVIEWED",
          "source_ref": "N31_QUICK_GUIDE_REV1_5",
          "source_type": "pdf"
        }
      ],
      "evidence_ids": [
        "E096",
        "E001",
        "E144",
        "E066",
        "E149",
        "E153",
        "E009",
        "E099",
        "E145",
        "E151",
        "E152",
        "E014",
        "E142"
      ],
      "explanation": "正确顺序为S01 → S02 → S03 → S04；每一步均在SOP中绑定前置关系和Evidence。",
      "explanation_evidence_ids": [
        "E096",
        "E001",
        "E144",
        "E066",
        "E149",
        "E153",
        "E009",
        "E099",
        "E145",
        "E151",
        "E152",
        "E014",
        "E142"
      ],
      "options": [
        {
          "evidence_ids": [
            "E009",
            "E099",
            "E145",
            "E151",
            "E152"
          ],
          "option_id": "O01",
          "text": "S03",
          "value": "S03"
        },
        {
          "evidence_ids": [
            "E096",
            "E001",
            "E144"
          ],
          "option_id": "O02",
          "text": "S01",
          "value": "S01"
        },
        {
          "evidence_ids": [
            "E014",
            "E142"
          ],
          "option_id": "O03",
          "text": "S04",
          "value": "S04"
        },
        {
          "evidence_ids": [
            "E096",
            "E066",
            "E144",
            "E149",
            "E153"
          ],
          "option_id": "O04",
          "text": "S02",
          "value": "S02"
        }
      ],
      "prompt": "请按SOP依赖关系排列以下步骤。",
      "question_id": "Q01",
      "step_ids": [
        "S01",
        "S02",
        "S03",
        "S04"
      ],
      "type": "ORDERING"
    },
    {
      "answer": [
        "N31 原装或适配电源"
      ],
      "answer_evidence_ids": [
        "E014",
        "E142"
      ],
      "category": "TOOL_SELECTION",
      "evidence_details": [
        {
          "claim": "CONTINUOUS_OPERATION 关键帧候选；等待授权后的视觉理解或人工确认动作、部件和设备状态。",
          "classification": "MODEL_INFERENCE",
          "confidence": 0.5,
          "evidence_id": "E014",
          "locator": {
            "end_ms": 70000,
            "keyframe": "derived/video/N31_VIDEO_OPERATION_FULL/frames/frame_000014.jpg",
            "start_ms": 65000
          },
          "relevance": 0.65,
          "review_status": "UNREVIEWED",
          "source_ref": "N31_VIDEO_OPERATION_FULL",